{
  "$schema": "http://json-schema.org/draft-07/schema#",
  "$id": "https://raw.githubusercontent.com/Virtual-Protocol/butler-skills/main/schema/recipe.schema.json",
  "title": "Butler duty template",
  "description": "Schema for recipe.json, the manifest at the root of a duty-template bundle (recipe.json, duty.py, README.md). This shape is fixed by the container's template installer \u2014 a field outside it is refused, never merged in.",
  "type": "object",
  "additionalProperties": false,
  "required": [
    "id",
    "version",
    "description",
    "params"
  ],
  "properties": {
    "id": {
      "type": "string",
      "pattern": "^[a-z0-9][a-z0-9-]{1,63}$",
      "description": "Must equal the `name` this template is listed under in templates.json \u2014 that is the ref a duty is created with (<id>@<version>)."
    },
    "version": {
      "type": "integer",
      "minimum": 1,
      "description": "A plain, monotonic integer \u2014 not semver. A ref is `<id>@<version>`."
    },
    "description": {
      "type": "string",
      "minLength": 1,
      "maxLength": 200,
      "description": "Composed into a 280-char field with a settings clause appended \u2014 a longer one is silently dropped by the caller, so the validator refuses it here instead."
    },
    "keywords": {
      "type": "array",
      "items": {
        "type": "string"
      }
    },
    "triggers": {
      "type": "array",
      "items": {
        "type": "string",
        "enum": [
          "timer",
          "group",
          "trade"
        ]
      }
    },
    "supersedes": {
      "type": "array",
      "items": {
        "type": "string",
        "pattern": "^[a-z0-9][a-z0-9-]{1,63}@\\d+$"
      },
      "description": "Older refs this version replaces, e.g. [\"dca@1\"]. Flattened into the published index's top-level `aliases`."
    },
    "keys": {
      "type": "array",
      "items": {
        "type": "string"
      },
      "description": "The stable idempotency-key format(s) this template's duty.py uses, documentation only \u2014 e.g. \"buy:<duty>:slot:<slot>\"."
    },
    "params": {
      "type": "object",
      "description": "A JSON-Schema OBJECT describing the settings a duty created from this template takes. Only the subset of JSON-Schema the container's params checker supports may appear anywhere in this tree (see recipe-params-subset.schema.json for the exact keyword allowlist, enforced recursively by scripts/validate.py's check_params_schema), plus one root-only conditional-required escape hatch, `allOf` (see below).",
      "properties": {
        "type": {
          "const": "object"
        },
        "properties": {
          "type": "object"
        },
        "required": {
          "type": "array",
          "items": {
            "type": "string"
          }
        },
        "additionalProperties": {
          "type": "boolean"
        },
        "allOf": {
          "type": "array",
          "items": {
            "type": "object"
          },
          "description": "Root-only conditional-required subset the container's params checker enforces (conditionalClauses in recipe-params.mjs) and scripts/validate.py's check_params_conditionals validates: [{if: {properties: {<name>: {const: ...} | {enum: [...]}}}, then: {required: [...]}}, ...]. A condition holds only when the named property is present; `then` contributes `required` alone. Refused anywhere below the root."
        }
      },
      "required": [
        "type",
        "properties"
      ]
    },
    "status": {
      "type": "object",
      "description": "The duty's status line, by state: the code calls bevo.status(\"<state>\", name=value) and this words it. \"starting\" shows before the first run. A line is a string, or {\"last\", \"next\"}. {next} is the next run; {name} is a value the code passes or a setting.",
      "minProperties": 1,
      "maxProperties": 12,
      "propertyNames": {
        "pattern": "^[a-z][a-z0-9_]{0,23}$"
      },
      "additionalProperties": {
        "oneOf": [
          {
            "type": "string",
            "minLength": 1,
            "maxLength": 120
          },
          {
            "type": "object",
            "additionalProperties": false,
            "minProperties": 1,
            "properties": {
              "last": {
                "type": "string",
                "minLength": 1,
                "maxLength": 120
              },
              "next": {
                "type": "string",
                "minLength": 1,
                "maxLength": 120
              }
            }
          }
        ]
      }
    }
  }
}
